{
  "$schema": "https://raw.githubusercontent.com/AutoDevJapan/GoDD-Design-Systems/main/documents/schema/index-summary.schema.json",
  "version": 1,
  "generatedAt": "2026-07-20T12:34:54.523Z",
  "sourceGeneratedAt": "2026-07-20T12:34:54.523Z",
  "entryCount": 51729,
  "pageSize": 1000,
  "pageCount": 52,
  "facets": {
    "jsic": [
      {
        "value": "8823",
        "count": 1382
      },
      {
        "value": "0522",
        "count": 1369
      },
      {
        "value": "7623",
        "count": 1348
      },
      {
        "value": "7299",
        "count": 1347
      },
      {
        "value": "7041",
        "count": 1340
      },
      {
        "value": "8543",
        "count": 1333
      },
      {
        "value": "0631",
        "count": 1329
      },
      {
        "value": "8036",
        "count": 1324
      },
      {
        "value": "8142",
        "count": 1318
      },
      {
        "value": "0796",
        "count": 1313
      },
      {
        "value": "0243",
        "count": 1310
      },
      {
        "value": "4121",
        "count": 1293
      },
      {
        "value": "4854",
        "count": 1289
      },
      {
        "value": "4499",
        "count": 1276
      },
      {
        "value": "6731",
        "count": 1273
      },
      {
        "value": "9293",
        "count": 1265
      },
      {
        "value": "8309",
        "count": 1260
      },
      {
        "value": "6512",
        "count": 1252
      },
      {
        "value": "3800",
        "count": 1233
      },
      {
        "value": "6211",
        "count": 1226
      },
      {
        "value": "6051",
        "count": 1222
      },
      {
        "value": "5721",
        "count": 1214
      },
      {
        "value": "5519",
        "count": 1201
      },
      {
        "value": "5897",
        "count": 1149
      },
      {
        "value": "0100",
        "count": 1143
      },
      {
        "value": "5351",
        "count": 1141
      },
      {
        "value": "7900",
        "count": 1134
      },
      {
        "value": "5211",
        "count": 1125
      },
      {
        "value": "1123",
        "count": 878
      },
      {
        "value": "1898",
        "count": 872
      },
      {
        "value": "3014",
        "count": 862
      },
      {
        "value": "1168",
        "count": 851
      },
      {
        "value": "3296",
        "count": 848
      },
      {
        "value": "2253",
        "count": 846
      },
      {
        "value": "2112",
        "count": 844
      },
      {
        "value": "2421",
        "count": 843
      },
      {
        "value": "2641",
        "count": 815
      },
      {
        "value": "1432",
        "count": 812
      },
      {
        "value": "1633",
        "count": 806
      },
      {
        "value": "0926",
        "count": 805
      },
      {
        "value": "2499",
        "count": 805
      },
      {
        "value": "1224",
        "count": 803
      },
      {
        "value": "1721",
        "count": 794
      },
      {
        "value": "2734",
        "count": 784
      },
      {
        "value": "2900",
        "count": 768
      },
      {
        "value": "2179",
        "count": 766
      },
      {
        "value": "1000",
        "count": 761
      },
      {
        "value": "3200",
        "count": 755
      },
      {
        "value": "6061",
        "count": 1
      },
      {
        "value": "7281",
        "count": 1
      }
    ],
    "color": [
      {
        "value": "ltg-h06",
        "count": 219
      },
      {
        "value": "ltg-h01",
        "count": 210
      },
      {
        "value": "d-h05",
        "count": 209
      },
      {
        "value": "d-h24",
        "count": 209
      },
      {
        "value": "dk-h09",
        "count": 206
      },
      {
        "value": "dkg-h13",
        "count": 206
      },
      {
        "value": "dkg-h20",
        "count": 206
      },
      {
        "value": "g-h13",
        "count": 206
      },
      {
        "value": "d-h17",
        "count": 205
      },
      {
        "value": "dk-h21",
        "count": 205
      },
      {
        "value": "g-h10",
        "count": 205
      },
      {
        "value": "lt-h17",
        "count": 204
      },
      {
        "value": "dk-h18",
        "count": 203
      },
      {
        "value": "ltg-h17",
        "count": 203
      },
      {
        "value": "g-h01",
        "count": 202
      },
      {
        "value": "g-h24",
        "count": 201
      },
      {
        "value": "d-h16",
        "count": 200
      },
      {
        "value": "dk-h04",
        "count": 199
      },
      {
        "value": "dkg-h07",
        "count": 199
      },
      {
        "value": "dp-h05",
        "count": 199
      },
      {
        "value": "sf-h14",
        "count": 199
      },
      {
        "value": "b-h06",
        "count": 198
      },
      {
        "value": "d-h01",
        "count": 198
      },
      {
        "value": "d-h19",
        "count": 198
      },
      {
        "value": "g-h18",
        "count": 198
      },
      {
        "value": "g-h23",
        "count": 198
      },
      {
        "value": "dkg-h11",
        "count": 197
      },
      {
        "value": "dkg-h17",
        "count": 197
      },
      {
        "value": "dp-h10",
        "count": 197
      },
      {
        "value": "g-h03",
        "count": 197
      },
      {
        "value": "g-h04",
        "count": 197
      },
      {
        "value": "ltg-h04",
        "count": 197
      },
      {
        "value": "dkg-h23",
        "count": 196
      },
      {
        "value": "g-h19",
        "count": 196
      },
      {
        "value": "s-h11",
        "count": 196
      },
      {
        "value": "d-h14",
        "count": 195
      },
      {
        "value": "dk-h05",
        "count": 195
      },
      {
        "value": "dkg-h21",
        "count": 195
      },
      {
        "value": "g-h05",
        "count": 195
      },
      {
        "value": "g-h06",
        "count": 195
      },
      {
        "value": "g-h16",
        "count": 195
      },
      {
        "value": "d-h12",
        "count": 194
      },
      {
        "value": "ac-w",
        "count": 193
      },
      {
        "value": "b-h13",
        "count": 193
      },
      {
        "value": "v-h22",
        "count": 193
      },
      {
        "value": "ac-mgy",
        "count": 192
      },
      {
        "value": "d-h13",
        "count": 192
      },
      {
        "value": "dk-h24",
        "count": 192
      },
      {
        "value": "dkg-h09",
        "count": 192
      },
      {
        "value": "g-h08",
        "count": 192
      },
      {
        "value": "p-h17",
        "count": 192
      },
      {
        "value": "v-h01",
        "count": 192
      },
      {
        "value": "v-h10",
        "count": 192
      },
      {
        "value": "b-h22",
        "count": 191
      },
      {
        "value": "dk-h10",
        "count": 191
      },
      {
        "value": "dk-h17",
        "count": 191
      },
      {
        "value": "dp-h23",
        "count": 191
      },
      {
        "value": "lt-h20",
        "count": 191
      },
      {
        "value": "ltg-h13",
        "count": 191
      },
      {
        "value": "p-h09",
        "count": 191
      },
      {
        "value": "sf-h17",
        "count": 191
      },
      {
        "value": "b-h23",
        "count": 190
      },
      {
        "value": "d-h15",
        "count": 190
      },
      {
        "value": "dk-h13",
        "count": 190
      },
      {
        "value": "dkg-h08",
        "count": 190
      },
      {
        "value": "d-h04",
        "count": 189
      },
      {
        "value": "dk-h06",
        "count": 189
      },
      {
        "value": "dk-h07",
        "count": 189
      },
      {
        "value": "dk-h11",
        "count": 189
      },
      {
        "value": "dkg-h04",
        "count": 189
      },
      {
        "value": "dp-h06",
        "count": 189
      },
      {
        "value": "p-h22",
        "count": 189
      },
      {
        "value": "dk-h22",
        "count": 188
      },
      {
        "value": "dkg-h18",
        "count": 188
      },
      {
        "value": "dp-h01",
        "count": 188
      },
      {
        "value": "dp-h13",
        "count": 188
      },
      {
        "value": "g-h12",
        "count": 188
      },
      {
        "value": "p-h04",
        "count": 188
      },
      {
        "value": "ac-bk",
        "count": 187
      },
      {
        "value": "b-h04",
        "count": 187
      },
      {
        "value": "b-h14",
        "count": 187
      },
      {
        "value": "d-h03",
        "count": 187
      },
      {
        "value": "dkg-h01",
        "count": 187
      },
      {
        "value": "dkg-h16",
        "count": 187
      },
      {
        "value": "dp-h07",
        "count": 187
      },
      {
        "value": "p-h06",
        "count": 187
      },
      {
        "value": "d-h06",
        "count": 186
      },
      {
        "value": "d-h21",
        "count": 186
      },
      {
        "value": "dk-h01",
        "count": 186
      },
      {
        "value": "dk-h20",
        "count": 186
      },
      {
        "value": "dkg-h24",
        "count": 186
      },
      {
        "value": "dp-h09",
        "count": 186
      },
      {
        "value": "dp-h15",
        "count": 186
      },
      {
        "value": "ltg-h11",
        "count": 186
      },
      {
        "value": "ltg-h22",
        "count": 186
      },
      {
        "value": "p-h03",
        "count": 186
      },
      {
        "value": "s-h22",
        "count": 186
      },
      {
        "value": "dk-h12",
        "count": 185
      },
      {
        "value": "dkg-h15",
        "count": 185
      },
      {
        "value": "g-h15",
        "count": 185